{
  "$schema": "http://json-schema.org/draft-07/schema#",
  "$id": "schema/regions.schema.json",
  "title": "Regions",
  "description": "Shape contract for shared/data/regions.json. Generated by tools/studio/gen-schemas.mjs — edit the generator, not this file.",
  "type": "object",
  "required": [
    "mapStyle",
    "regions",
    "unlockOrder",
    "version"
  ],
  "additionalProperties": false,
  "properties": {
    "$schema": {
      "type": "string"
    },
    "_comment": {
      "type": "string"
    },
    "mapStyle": {
      "type": "string"
    },
    "regions": {
      "type": "array",
      "items": {
        "type": "object",
        "properties": {
          "challenge": {
            "type": "object",
            "properties": {
              "goal": {
                "type": "integer"
              },
              "id": {
                "type": "string",
                "pattern": "^[a-z][a-z0-9_]*$"
              },
              "rule": {
                "type": "string"
              }
            },
            "required": [
              "goal",
              "id",
              "rule"
            ]
          },
          "decor": {
            "type": "array",
            "items": {
              "type": "string"
            }
          },
          "equipment": {
            "type": "array",
            "items": {
              "type": "string"
            }
          },
          "id": {
            "type": "string",
            "pattern": "^[a-z][a-z0-9_]*$"
          },
          "ingredients": {
            "type": "array",
            "items": {
              "type": "string"
            }
          },
          "nameKey": {
            "type": "string"
          },
          "states": {
            "type": "array",
            "items": {
              "type": "string"
            }
          },
          "traditionKey": {
            "type": "string"
          }
        },
        "required": [
          "challenge",
          "decor",
          "equipment",
          "id",
          "ingredients",
          "nameKey",
          "states",
          "traditionKey"
        ]
      }
    },
    "unlockOrder": {
      "type": "array",
      "items": {
        "type": "string"
      }
    },
    "version": {
      "type": "integer"
    }
  }
}
